{
  "generatedAt": "2026-10-26T09:01:48.076Z",
  "registryName": "meta-kim-capabilities",
  "scope": "repo-canonical",
  "canonicalProjection": "config/capability-index/meta-kim-capabilities.json",
  "canonicalSource": "config/capability-index/meta-kim-capabilities.json",
  "localGlobalInventory": ".meta-kim/state/{profile}/capability-index/global-capabilities.json",
  "mirroredTo": [
    ".claude/capability-index/meta-kim-capabilities.json",
    ".codex/capability-index/meta-kim-capabilities.json",
    "openclaw/capability-index/meta-kim-capabilities.json",
    ".cursor/capability-index/meta-kim-capabilities.json"
  ],
  "fetchOrder": [
    "repo canonical capability index",
    "runtime mirror",
    "local global inventory",
    "capability gap packet and return to Thinking"
  ],
  "summary": {
    "totalAgents": 9,
    "totalSkills": 18,
    "totalHooks": 29,
    "totalMcpServers": 1,
    "totalMcpTools": 7,
    "totalPlugins": 3,
    "totalCommands": 7,
    "countSemantics": {
      "totalHooks": "canonical_inventory_entries",
      "totalCommands": "canonical_inventory_entries"
    }
  },
  "abstractCapabilitySlots": [
    {
      "slotId": "run-scoped-meta-skill-selection",
      "description": "Abstract slot for selecting concrete child skills at runtime Fetch without binding them into long-term meta-agent identity.",
      "allowedProviderIds": [
        "meta-theory",
        "agent-teams-playbook",
        "superpowers",
        "ecc",
        "findskill"
      ],
      "selectedSkillScope": "run_only"
    },
    {
      "slotId": "interface-integration-contract",
      "description": "Abstract slot for internal API and third-party provider integration work: evidence-backed field ledger, provider adapter boundary, auth/signature, idempotency, callback, error model, contract tests, observability, and rollback gates.",
      "allowedProviderIds": [
        "meta-theory",
        "agent-teams-playbook",
        "superpowers",
        "ecc",
        "findskill"
      ],
      "selectedSkillScope": "run_only"
    }
  ],
  "metaSkillProviders": {
    "meta-theory": {
      "id": "meta-theory",
      "providerKind": "meta-skill-package",
      "allowedForLongTermAgentIdentity": true,
      "concreteSubSkillBindingForbidden": true,
      "notes": "May be referenced as a long-term provider package; concrete child skills are selected per run during Fetch."
    },
    "agent-teams-playbook": {
      "id": "agent-teams-playbook",
      "providerKind": "meta-skill-package",
      "allowedForLongTermAgentIdentity": true,
      "concreteSubSkillBindingForbidden": true,
      "notes": "May be referenced as a long-term provider package; concrete child skills are selected per run during Fetch."
    },
    "superpowers": {
      "id": "superpowers",
      "providerKind": "meta-skill-package",
      "allowedForLongTermAgentIdentity": true,
      "concreteSubSkillBindingForbidden": true,
      "notes": "May be referenced as a long-term provider package; concrete child skills are selected per run during Fetch."
    },
    "ecc": {
      "id": "ecc",
      "providerKind": "meta-skill-package",
      "allowedForLongTermAgentIdentity": true,
      "concreteSubSkillBindingForbidden": true,
      "notes": "May be referenced as a long-term provider package; concrete child skills are selected per run during Fetch."
    },
    "findskill": {
      "id": "findskill",
      "providerKind": "meta-skill-package",
      "allowedForLongTermAgentIdentity": true,
      "concreteSubSkillBindingForbidden": true,
      "notes": "May be referenced as a long-term provider package; concrete child skills are selected per run during Fetch."
    }
  },
  "runtimeSelectedSkills": {
    "selectedSkillScope": "run_only",
    "persistencePolicy": "Runtime-selected concrete skills are scoped to the current run and must not be persisted into long-term agent identity."
  },
  "longTermAgentIdentityPolicy": {
    "forbidConcreteSkillInLongTermAgentIdentity": true,
    "allowedMetaSkillProviderIds": [
      "meta-theory",
      "agent-teams-playbook",
      "superpowers",
      "ecc",
      "findskill"
    ],
    "forbiddenConcreteSkillPatterns": [
      "provider/*",
      "provider:child-skill",
      "runtime-specific child skill id"
    ]
  },
  "byCapabilityType": {
    "agents": {
      "repo:canonical:meta-artisan": {
        "id": "meta-artisan",
        "type": "agents",
        "namespace": "canonical",
        "path": "canonical/agents/meta-artisan.md",
        "size": 21736,
        "modified": "2026-06-03T19:03:51.022Z",
        "layer": "meta",
        "executionBlock": true
      },
      "repo:canonical:meta-chrysalis": {
        "id": "meta-chrysalis",
        "type": "agents",
        "namespace": "canonical",
        "path": "canonical/agents/meta-chrysalis.md",
        "size": 32722,
        "modified": "2026-07-11T11:37:44.839Z",
        "layer": "meta",
        "executionBlock": true
      },
      "repo:canonical:meta-conductor": {
        "id": "meta-conductor",
        "type": "agents",
        "namespace": "canonical",
        "path": "canonical/agents/meta-conductor.md",
        "size": 62949,
        "modified": "2026-08-11T17:17:15.587Z",
        "layer": "meta",
        "executionBlock": true
      },
      "repo:canonical:meta-genesis": {
        "id": "meta-genesis",
        "type": "agents",
        "namespace": "canonical",
        "path": "canonical/agents/meta-genesis.md",
        "size": 25001,
        "modified": "2026-06-03T19:03:51.022Z",
        "layer": "meta",
        "executionBlock": true
      },
      "repo:canonical:meta-librarian": {
        "id": "meta-librarian",
        "type": "agents",
        "namespace": "canonical",
        "path": "canonical/agents/meta-librarian.md",
        "size": 25261,
        "modified": "2026-06-03T19:03:51.023Z",
        "layer": "meta",
        "executionBlock": true
      },
      "repo:canonical:meta-prism": {
        "id": "meta-prism",
        "type": "agents",
        "namespace": "canonical",
        "path": "canonical/agents/meta-prism.md",
        "size": 37013,
        "modified": "2026-06-20T16:21:51.065Z",
        "layer": "meta",
        "executionBlock": true
      },
      "repo:canonical:meta-scout": {
        "id": "meta-scout",
        "type": "agents",
        "namespace": "canonical",
        "path": "canonical/agents/meta-scout.md",
        "size": 22704,
        "modified": "2026-06-15T18:37:12.121Z",
        "layer": "meta",
        "executionBlock": true
      },
      "repo:canonical:meta-sentinel": {
        "id": "meta-sentinel",
        "type": "agents",
        "namespace": "canonical",
        "path": "canonical/agents/meta-sentinel.md",
        "size": 23364,
        "modified": "2026-06-28T22:39:37.160Z",
        "layer": "meta",
        "executionBlock": true
      },
      "repo:canonical:meta-warden": {
        "id": "meta-warden",
        "type": "agents",
        "namespace": "canonical",
        "path": "canonical/agents/meta-warden.md",
        "size": 42835,
        "modified": "2026-06-20T16:21:45.589Z",
        "layer": "meta",
        "executionBlock": true
      }
    },
    "skills": {
      "repo:canonical:meta-theory": {
        "id": "meta-theory",
        "type": "skills",
        "namespace": "canonical",
        "path": "canonical/skills/meta-theory/SKILL.md",
        "size": 95729,
        "modified": "2026-10-23T19:28:29.045Z"
      },
      "repo:canonical:same-set-reusable-flow-for-project-file-inventor": {
        "id": "same-set-reusable-flow-for-project-file-inventor",
        "type": "skills",
        "namespace": "canonical",
        "path": "canonical/skills/same-set-reusable-flow-for-project-file-inventor/SKILL.md",
        "size": 5262,
        "modified": "2026-06-12T18:22:16.661Z"
      },
      "repo:canonical-reference:create-agent": {
        "id": "create-agent",
        "type": "skills",
        "namespace": "canonical-reference",
        "path": "canonical/skills/meta-theory/references/create-agent.md",
        "relativePath": "create-agent.md",
        "size": 33584,
        "modified": "2026-06-08T18:31:58.766Z"
      },
      "repo:canonical-reference:dev-governance": {
        "id": "dev-governance",
        "type": "skills",
        "namespace": "canonical-reference",
        "path": "canonical/skills/meta-theory/references/dev-governance.md",
        "relativePath": "dev-governance.md",
        "size": 34798,
        "modified": "2026-10-23T19:28:29.046Z"
      },
      "repo:canonical-reference:evolution-writeback": {
        "id": "evolution-writeback",
        "type": "skills",
        "namespace": "canonical-reference",
        "path": "canonical/skills/meta-theory/references/evolution-writeback.md",
        "relativePath": "evolution-writeback.md",
        "size": 4117,
        "modified": "2026-07-15T19:47:38.591Z"
      },
      "repo:canonical-reference:global-owner-discovery": {
        "id": "global-owner-discovery",
        "type": "skills",
        "namespace": "canonical-reference",
        "path": "canonical/skills/meta-theory/references/global-owner-discovery.md",
        "relativePath": "global-owner-discovery.md",
        "size": 11695,
        "modified": "2026-10-26T07:19:50.105Z"
      },
      "repo:canonical-reference:intent-amplification": {
        "id": "intent-amplification",
        "type": "skills",
        "namespace": "canonical-reference",
        "path": "canonical/skills/meta-theory/references/intent-amplification.md",
        "relativePath": "intent-amplification.md",
        "size": 17861,
        "modified": "2026-10-23T19:28:29.048Z"
      },
      "repo:canonical-reference:meta-theory": {
        "id": "meta-theory",
        "type": "skills",
        "namespace": "canonical-reference",
        "path": "canonical/skills/meta-theory/references/meta-theory.md",
        "relativePath": "meta-theory.md",
        "size": 21460,